Issue Type,Custom field (Patch Info),Issue key,Issue id,Parent id,Summary,Assignee,Reporter,Priority,Status,Resolution,Created,Updated,Due Date
Bug,,CAMEL-11987,13115814,,Camel-SalesForce DTO Issue while using camel-salesforce-maven,zregvart,srinivasks22,Blocker,Resolved,Fixed,2017-11-03 2:58,2017-11-13 20:58,
Bug,,CAMEL-12913,13195950,,Does camel disruptor hold processed messages?,,D001,Critical,Resolved,Invalid,2018-11-02 18:19,2018-11-02 18:45,
Bug,,CAMEL-12035,13120649,,Route attribute LastError is either Unavailable and shown as [object Object],,micheldf,Critical,Resolved,Invalid,2017-11-24 15:59,2017-11-24 17:28,
Bug,,CAMEL-12031,13120571,,KafkaConsumer stops consuming messages when exception occurs during offset commit,davsclaus,rgala,Major,Resolved,Fixed,2017-11-24 6:09,2019-03-05 10:00,
Bug,,CAMEL-11994,13116183,,Add call options to the camel-grpc component,,dmvolod,Major,Open,,2017-11-04 17:42,2019-01-31 14:08,
Bug,Patch Available,CAMEL-12969,13201658,,camel-core-osgi: Slow Memory Leak in OsgiServiceRegistry,davsclaus,bobpaulin,Major,Resolved,Fixed,2018-11-30 15:46,2018-12-30 19:38,
Bug,Patch Available,CAMEL-12987,13203243,,camel-core-osgi: OsgiServiceRegistry.onContextStop never gets called.,davsclaus,bobpaulin,Major,Resolved,Fixed,2018-12-09 2:58,2018-12-11 13:22,
Bug,,CAMEL-12727,13178648,,java.util.ConcurrentModificationException at org.apache.camel.impl.DefaultExchange.createProperties(DefaultExchange.java:550) in 2.20.1,davsclaus,boutblock,Major,Resolved,Fixed,2018-08-13 17:23,2018-08-27 11:58,
Bug,,CAMEL-12648,13171888,,ExchangeSentEvent not fired if no EventNotifier is accepting ExchangeSendingEvent,davsclaus,kgarner,Major,Resolved,Not A Problem,2018-07-13 1:58,2018-07-18 3:28,
Bug,,CAMEL-12550,13163172,,Camel-Twilio: Karaf feature is not working,ancosen,ancosen,Major,Resolved,Fixed,2018-05-31 14:31,2018-05-31 14:44,
Bug,,CAMEL-12359,13145846,,withAdvice() + weaveById() failing for global onException() route definitions,davsclaus,nkhalasi,Major,Resolved,Fixed,2018-03-16 20:12,2018-03-21 12:14,
Bug,,CAMEL-11956,13112581,,Support Spring 5.0.x,davsclaus,gnt,Major,Resolved,Fixed,2017-10-27 12:03,2018-03-21 7:49,
Bug,,CAMEL-12343,13144192,,Using DefautMessage() and GenericFileMessage() without CamelContext throw Exception,davsclaus,fhassak,Major,Resolved,Not A Bug,2018-03-12 0:17,2018-03-17 18:44,
Bug,,CAMEL-12324,13142918,,Issue:Camel rabbitmq publishes message to consumer exchange instead of publisher exchange,davsclaus,zohebp,Major,Closed,Not A Bug,2018-03-06 17:10,2018-03-07 9:18,
Bug,,CAMEL-11977,13115382,,MongoDB Tailable cursor consumer fails to stop on shutdown,ancosen,Igorko,Major,Resolved,Fixed,2017-11-01 15:17,2018-02-12 11:23,
Bug,,CAMEL-12228,13136223,,Print command fails in case of multiple copies,dmvolod,rvanderhallen,Major,Resolved,Fixed,2018-02-05 9:24,2018-02-06 6:50,
Bug,,CAMEL-11996,13116710,,RabbitConsumer could hang when RabbitMQ connection is lost and autoAck=false.,davsclaus,jmongard,Major,Resolved,Fixed,2017-11-07 15:33,2018-02-02 8:53,
Bug,,CAMEL-12211,13134570,,Idempotent on camel 2.20.0 and 2.20.1 allows duplication,davsclaus,pampanz,Major,Resolved,Duplicate,2018-01-29 21:35,2018-01-30 7:45,
Bug,,CAMEL-11940,13111381,,Automate update of online xsd on each release,,apupier,Major,Open,,2017-10-23 11:44,2018-01-23 12:30,
Bug,,CAMEL-12155,13131821,,Indicate Camel-Dozer major upgrade in Camel 2.20 release note and specify how to migrate,davsclaus,aurelien.pupier,Major,Resolved,Fixed,2018-01-18 9:11,2018-01-22 8:24,
Bug,,CAMEL-12134,13129821,,spring-boot: two camel contexts created when using xml configuration,nferraro,nferraro,Major,Resolved,Fixed,2018-01-10 11:14,2018-01-11 7:35,
Bug,,CAMEL-12120,13128293,,ErrorHandler is closed after failure in RoutingSlip ,davsclaus,sycyhy,Major,Resolved,Fixed,2018-01-03 19:04,2018-01-05 11:41,
Bug,,CAMEL-12113,13128191,,"Camel healthcheck spring-boot actuators don't honor ""endpoints.*.enabled"" property ",davsclaus,valdar,Major,Resolved,Fixed,2018-01-03 9:34,2018-01-03 11:30,
Bug,,CAMEL-12110,13128045,,KafkaConsumer swallows exceptions from org.apache.kafka.clients.consumer.KafkaConsumer constructor,davsclaus,lexsoto,Major,Resolved,Fixed,2018-01-02 18:42,2018-01-03 11:24,
Bug,,CAMEL-12072,13123472,,Netty version in Camel 2.20.0+ not comptatable with Netty in camel-etcd component,ancosen,bobpaulin,Major,Resolved,Fixed,2017-12-07 13:59,2017-12-10 9:53,
Bug,,CAMEL-11919,13109979,,"Salesforce REST API request headers not included in update,upsert,create and query operations",zregvart,dickengeorge,Major,Resolved,Fixed,2017-10-17 13:41,2017-11-25 23:48,
Bug,Patch Available,CAMEL-12037,13120666,,File idempotent repository is always initialized with default 1000 cache size,,zurkin,Major,Resolved,Fixed,2017-11-24 17:18,2017-11-25 17:05,
Bug,,CAMEL-12016,13119605,,Invalid Pool Exhausted error on camel-netty4,ancosen,dvor4x,Major,Resolved,Fixed,2017-11-20 10:12,2017-11-20 12:07,
Bug,,CAMEL-12010,13118486,,Mock endpoint - Should reset StreamCache when evaluating expecations,davsclaus,davsclaus,Major,Resolved,Fixed,2017-11-15 9:26,2017-11-15 10:17,
Bug,,CAMEL-11999,13117192,,Cannot create queue/message for Azure,tdiesler,tdiesler,Major,Resolved,Fixed,2017-11-09 6:41,2017-11-13 14:10,
Bug,,CAMEL-11900,13108901,,cluster-service : only the first event listener is notified about cluster events,lb,lb,Major,Resolved,Fixed,2017-10-12 12:24,2017-11-11 11:42,
Bug,,CAMEL-12001,13117329,,Cannot create a component based on the SqlComponent,lb,kstam,Major,Resolved,Fixed,2017-11-09 16:52,2017-11-10 8:44,
Bug,,CAMEL-12000,13117197,,HazelcastRoutePolicy should handle server status change,,abccbaandy,Major,Open,,2017-11-09 7:31,2017-11-09 7:31,
Bug,,CAMEL-11998,13117005,,Configuring SSL via endpointProperty in restConfiguration for an Undertow component will cause a BindException for multiple endpoints,,Rovo,Major,Open,,2017-11-08 15:29,2017-11-08 15:59,
Bug,,CAMEL-11997,13116909,,camel-archetype-component - Should generate DefaultComponent,davsclaus,davsclaus,Major,Resolved,Fixed,2017-11-08 8:52,2017-11-08 8:59,
Bug,,CAMEL-11988,13115870,,camel-jetty - Problem with laBug Spring Boot 1.5.8,davsclaus,davsclaus,Major,Resolved,Fixed,2017-11-03 9:37,2017-11-03 9:38,
Bug,,CAMEL-11970,13113416,,JacksonDataFormat does not pickup custom ObjectMapper from Registry,davsclaus,tlark,Major,Resolved,Fixed,2017-10-31 19:49,2017-11-02 12:48,
Bug,,CAMEL-11978,13115431,,camel-swagger-java - Include 200 status response as default in generated api-doc,davsclaus,davsclaus,Major,Resolved,Fixed,2017-11-01 18:28,2017-11-01 18:30,
Bug,,CAMEL-11974,13115353,,Camel Commands do not install in Karaf 4.0.X,,brawlinson,Major,Resolved,Duplicate,2017-11-01 13:19,2017-11-01 13:22,
Bug,,CAMEL-11951,13112351,,Uri matching does not match request type,davsclaus,robert.hillier,Major,Resolved,Fixed,2017-10-26 17:44,2017-10-31 19:00,
Bug,,CAMEL-11963,13112826,,camel-spring-boot - Actuator endpoints for MVC should only trigger if web application,davsclaus,davsclaus,Major,Resolved,Fixed,2017-10-28 15:50,2017-10-28 15:56,
Bug,,CAMEL-11960,13112777,,camel-swagger-java - Generated swagger doc should use primitive types,davsclaus,davsclaus,Major,Resolved,Fixed,2017-10-28 7:51,2017-10-28 7:55,
Bug,,CAMEL-11958,13112616,,rest-dsl - Disable vendor extension by default,davsclaus,davsclaus,Major,Resolved,Fixed,2017-10-27 14:35,2017-10-27 14:54,
Bug,,CAMEL-11947,13112202,,Possible race condition in iec60870 producer,,jamesnetherton,Major,Open,,2017-10-26 7:41,2017-10-26 7:41,
Bug,,CAMEL-11945,13111923,,camel-spring-boot - CamelContextConfiguration afterApplicationStart should trigger later,davsclaus,davsclaus,Major,Resolved,Fixed,2017-10-25 9:59,2017-10-25 10:03,
Bug,,CAMEL-11925,13110661,,Atmos component fails to load atmos.properties in a modular class loading environment ,jamesnetherton,jamesnetherton,Major,Resolved,Fixed,2017-10-19 12:51,2017-10-24 8:50,
Bug,,CAMEL-11939,13111362,,asn1 dataformat is not part of xsd for global dataformat,,apupier,Major,Resolved,Cannot Reproduce,2017-10-23 10:44,2017-10-23 14:54,
Bug,,CAMEL-11938,13111360,,Thrift data format is not part of the xsd for dataformats,,apupier,Major,Resolved,Cannot Reproduce,2017-10-23 10:40,2017-10-23 14:54,
Bug,,CAMEL-11936,13111340,,Fix syntax for Atomix component,ancosen,apupier,Major,Resolved,Fixed,2017-10-23 9:01,2017-10-23 10:37,
Bug,,CAMEL-11935,13111315,,Propagate Kafka record headers to camel headers,ancosen,ludvicekj,Major,Resolved,Fixed,2017-10-23 8:07,2017-10-23 9:04,
Bug,,CAMEL-11922,13110218,,Persistent tail tracking picks random tail tracker from mongoDB collection,ancosen,Igorko,Major,Resolved,Fixed,2017-10-18 8:13,2017-10-20 11:15,
Bug,,CAMEL-11912,13109650,,Camel Dropbox validator regex is too restrictive and fails for common paths,davsclaus,thagg1975,Major,Resolved,Fixed,2017-10-16 8:43,2017-10-20 10:44,
Bug,,CAMEL-11920,13110041,,camel-hdfs2 not working in osgi using documented HdfsOsgiHelper,ancosen,valdar,Major,Resolved,Fixed,2017-10-17 17:01,2017-10-18 10:23,
Bug,,CAMEL-11873,13106467,,Exclude validation-api from Salesforce component,zregvart,zregvart,Major,Resolved,Implemented,2017-10-02 16:10,2017-10-16 13:21,
Bug,,CAMEL-11911,13109437,,Setup CI server to build 2.20.x SNAPSHOT builds,davsclaus,davsclaus,Major,Resolved,Fixed,2017-10-14 12:52,2017-10-16 11:04,
Bug,,CAMEL-11909,13109435,,camel-catalog-maven - Cannot load out of the box components,davsclaus,davsclaus,Major,Resolved,Fixed,2017-10-14 12:23,2017-10-16 9:14,
Bug,,CAMEL-11902,13108975,,cluster-service : FileLockClusterView should not always return local member as leader,lb,lb,Major,Resolved,Fixed,2017-10-12 16:50,2017-10-12 17:04,
Bug,,CAMEL-11892,13108510,,SpringWebserviceConsumer and class cast exception,onders,r.groote@beinformed.com,Major,Resolved,Fixed,2017-10-11 6:59,2017-10-12 14:35,
Bug,,CAMEL-11890,13108043,,camel-connector - Use JSon parser to parse the camel-connector-schema.json,davsclaus,davsclaus,Major,Resolved,Fixed,2017-10-09 18:17,2017-10-12 7:07,
Bug,,CAMEL-11895,13108601,,camel-hystrix - Expose state of circuit breaker on JMX / processor,davsclaus,davsclaus,Major,Resolved,Fixed,2017-10-11 13:22,2017-10-12 7:07,
Bug,,CAMEL-11884,13107202,,NPE when stopping Salesforce component that failed to start,zregvart,zregvart,Major,Resolved,Fixed,2017-10-05 11:23,2017-10-05 11:26,
Bug,,CAMEL-11867,13106099,,camel-bom needs <distributionManagement/>,nferraro,tcunning,Major,Resolved,Fixed,2017-09-29 17:53,2017-10-03 9:52,
Bug,,CAMEL-11847,13105151,,cluster-service : support multiple cluster services,lb,lb,Major,Resolved,Fixed,2017-09-26 16:24,2017-09-27 14:20,
Bug,,CAMEL-11842,13105071,,ClassNotFoundException when configuring camel-docker SSL options,jamesnetherton,jamesnetherton,Major,Resolved,Fixed,2017-09-26 12:43,2017-09-27 7:06,
Bug,,CAMEL-11814,13104499,,camel-spring-boot - Recent change in startup behaviour can cause camel-Bug-spring problems,zregvart,davsclaus,Major,Resolved,Fixed,2017-09-23 10:51,2017-09-26 12:55,
Bug,,CAMEL-11812,13104484,,spring-boot-starter - Unit Bug fail in netty,davsclaus,davsclaus,Major,Resolved,Fixed,2017-09-23 8:30,2017-09-23 8:58,
Bug,,CAMEL-11768,13101132,,camel-iBug-karaf - CamelDockerBug fails,tadayosi,tadayosi,Major,Resolved,Fixed,2017-09-11 3:08,2017-09-11 7:52,
Bug,,CAMEL-11758,13100339,,camel-iBug-karaf - CamelBeanValidatorBug fails on Jenkins,tadayosi,tadayosi,Major,Resolved,Fixed,2017-09-07 1:23,2017-09-11 2:04,
Bug,,CAMEL-11759,13100349,,camel-iBug-karaf - CamelNagiosBug fails,tadayosi,tadayosi,Major,Resolved,Fixed,2017-09-07 2:34,2017-09-07 7:26,
Bug,,CAMEL-11760,13100354,,camel-iBug-karaf - CamelServicenowBug fails,tadayosi,tadayosi,Major,Resolved,Fixed,2017-09-07 3:25,2017-09-07 7:26,
Bug,,CAMEL-11667,13094409,,Support Metadata component extension,zregvart,zregvart,Major,Resolved,Implemented,2017-08-14 8:16,2017-08-29 15:09,
Bug,,CAMEL-11674,13095105,,Couchbase client is never shut down,ancosen,jamesnetherton,Major,Resolved,Fixed,2017-08-16 19:11,2017-08-21 8:38,
Bug,,CAMEL-11652,13093249,,Upgrade dozer to 6.1,ancosen,garethahealy,Major,Resolved,Fixed,2017-08-08 17:32,2017-08-09 7:16,
Bug,,CAMEL-11610,13090473,,UnsatisfiedDependencyException: Error creating bean with name 'openTracingEventNotifier',davsclaus,objectiser,Major,Resolved,Fixed,2017-07-27 9:33,2017-07-27 14:17,
Bug,Patch Available,CAMEL-11605,13090299,,Invalid accept header,dmvolod,giger,Major,Resolved,Fixed,2017-07-26 18:58,2017-07-27 11:10,
Bug,,CAMEL-11569,13088718,,Implements CAMEL-11425 for camel-olingo4,dmvolod,dmvolod,Major,Resolved,Fixed,2017-07-20 11:28,2017-07-25 9:17,
Bug,,CAMEL-11476,13083151,,spring-boot - routes not loaded when setting a management.port,zregvart,nferraro,Major,Resolved,Fixed,2017-06-28 14:17,2017-06-29 12:34,
Bug,,CAMEL-11465,13082862,,NPE caused by IrcMessage,davsclaus,jamesnetherton,Major,Resolved,Fixed,2017-06-27 15:58,2017-06-28 16:40,
Bug,,CAMEL-11436,13081815,,camel-spring-ldap - Has Bug failures,dmvolod,davsclaus,Major,Resolved,Fixed,2017-06-22 15:14,2017-06-23 8:12,
Bug,,CAMEL-11407,13079640,,camel-opentracing loggingtracer needs to build before client,zregvart,tcunning,Major,Resolved,Fixed,2017-06-14 4:08,2017-06-15 13:31,
Bug,,CAMEL-11411,13079826,,camel-opentracing example uses incorrect groupId,davsclaus,tcunning,Major,Resolved,Fixed,2017-06-14 17:32,2017-06-15 13:31,
Bug,,CAMEL-11405,13079482,,Create a per-SpringCamelContext replacement for `noStart` flag,zregvart,zregvart,Major,Open,,2017-06-13 13:11,2017-06-13 13:12,
Bug,,CAMEL-11369,13075872,,camel-spring-boot-starter generator paste incorrect default value,dmvolod,dmvolod,Major,Resolved,Fixed,2017-05-30 16:02,2017-06-02 11:03,
Bug,,CAMEL-11334,13074923,,camel-grpc - Unit Bug fails due port number issue,nferraro,davsclaus,Major,Resolved,Fixed,2017-05-25 17:47,2017-05-27 7:48,
Bug,,CAMEL-12002,13117552,,Make camel-docker work with TLS on OSGi,jamesnetherton,jamesnetherton,Minor,Resolved,Fixed,2017-11-10 11:41,2019-04-03 9:04,
Bug,,CAMEL-11818,13104530,,cluster service : review spring boot configuration order,lb,lb,Minor,Open,,2017-09-23 15:38,2018-11-16 10:14,
Bug,,CAMEL-12271,13138974,,SharedInternalProcessor attempts to call ResultProcessor after camel upgrade,,dfullarton,Minor,Open,,2018-02-16 5:45,2018-09-20 7:02,
Bug,,CAMEL-12520,13159822,,FluentProducerTemplate.withExchange() does not seem to send exchange,davsclaus,Steve973,Minor,Resolved,Fixed,2018-05-16 20:31,2018-08-16 8:45,
Bug,,CAMEL-11918,13109931,,Wrong parent version in connectors/examples/pom.xml,,paolo.antinori,Minor,Open,,2017-10-17 9:43,2018-06-26 10:58,
Bug,,CAMEL-11962,13112785,,AdviceWith weaveAddFirst using onCompletion issue,davsclaus,davsclaus,Minor,Resolved,Fixed,2017-10-28 9:09,2018-03-16 20:16,
Sub-Bug,,CAMEL-11823,13104651,13072980,[example] cdi-cassandrasql - nodetool: Failed to connect to '127.0.0.1:7199' - ConnectException: 'Connection refused',ancosen,igarashitm,Minor,Resolved,Fixed,2017-09-25 4:33,2018-03-09 8:56,
Bug,,CAMEL-11773,13101666,,Popup message about SyntaxHiglighter when accessing camel 2.20 release note page,davsclaus,apupier,Minor,Resolved,Fixed,2017-09-12 14:27,2018-02-01 15:13,
Bug,,CAMEL-12220,13135393,,Add Trigger based download to RemoteFileComponent,,koszta5,Minor,Resolved,Not A Problem,2018-02-01 11:24,2018-02-01 13:48,
Bug,,CAMEL-11942,13111635,,camel-spring build failure on windows,,onders,Minor,Resolved,Fixed,2017-10-24 8:30,2017-11-25 11:30,
Bug,,CAMEL-11973,13115328,,Error in component WireTap,,andrykv,Minor,Resolved,Incomplete,2017-11-01 10:49,2017-11-08 10:42,
Bug,,CAMEL-11763,13100703,,Some camel-milo unit Bugs pass even when exceptions are thrown ,,jamesnetherton,Minor,Open,,2017-09-08 7:25,2017-11-08 10:07,
Bug,,CAMEL-11991,13115905,,camel-swagger-java - Allow to specify type as date format,davsclaus,davsclaus,Minor,Resolved,Fixed,2017-11-03 12:18,2017-11-03 12:41,
Bug,,CAMEL-11983,13115634,,XsltAggregationStrategy thread safety during initialization,davsclaus,salagator,Minor,Resolved,Fixed,2017-11-02 14:08,2017-11-02 18:13,
Bug,,CAMEL-11979,13115439,,camel-undertow - swagger api should match on uri prefix,davsclaus,davsclaus,Minor,Resolved,Fixed,2017-11-01 19:04,2017-11-01 19:05,
Bug,Patch Available,CAMEL-11967,13113109,,Restlet binding should not create jaxb marshaller when binding mode is set to json,davsclaus,transamericamoon,Minor,Resolved,Fixed,2017-10-30 18:29,2017-10-31 12:55,
Bug,,CAMEL-11965,13113051,,camel BOM (and camel-hl7) lack the optional dependency to hapi-structures-v251,ancosen,valdar,Minor,Resolved,Fixed,2017-10-30 15:00,2017-10-31 6:26,
Bug,,CAMEL-11961,13112780,,ClassCastException in HttpMessage,davsclaus,davsclaus,Minor,Resolved,Fixed,2017-10-28 8:34,2017-10-28 8:55,
Bug,,CAMEL-11955,13112551,,Using @AdviceWith and Buging camel-spring-boot startup CamelContext eager,davsclaus,davsclaus,Minor,Resolved,Fixed,2017-10-27 9:36,2017-10-27 10:58,
Bug,,CAMEL-11948,13112204,,NPE on DefaultMessage setBody if deprecated constructor was used,davsclaus,thopap,Minor,Closed,Fixed,2017-10-26 7:47,2017-10-27 9:32,
Bug,,CAMEL-11952,13112369,,XSLT options not set when resource URI is http,davsclaus,tflaherty,Minor,Resolved,Fixed,2017-10-26 18:26,2017-10-27 8:01,
Bug,,CAMEL-11953,13112473,,maven connector plugin: connector only properties are ignored in spring boot code generation,lb,lb,Minor,Resolved,Fixed,2017-10-27 5:44,2017-10-27 6:08,
Bug,,CAMEL-11946,13111940,,Invalid artifactId in docs for camel-json-validator,tdiesler,tdiesler,Minor,Resolved,Fixed,2017-10-25 11:45,2017-10-25 14:02,
Bug,,CAMEL-11944,13111901,,Ensure HBaseConfiguration ClassLoader is set correctly,jamesnetherton,jamesnetherton,Minor,Resolved,Fixed,2017-10-25 8:01,2017-10-25 12:11,
Bug,,CAMEL-11937,13111341,,Fix syntax for iec60870 component,ancosen,apupier,Minor,Resolved,Fixed,2017-10-23 9:02,2017-10-24 7:24,
Bug,,CAMEL-11917,13109926,,camel-jgroups-starter : JGroupsLockClusterService auto configuration lacks enable flag,lb,lb,Minor,Resolved,Fixed,2017-10-17 9:13,2017-10-17 9:20,
Bug,,CAMEL-11916,13109925,,camel-jgroups-starter : JGroupsLockClusterServiceConfiguration lacks getter/setters,lb,lb,Minor,Resolved,Fixed,2017-10-17 9:09,2017-10-17 9:20,
Bug,,CAMEL-11910,13109436,,camel-maven-plugin - validate should not include route ids as consumer urls,davsclaus,davsclaus,Minor,Resolved,Fixed,2017-10-14 12:44,2017-10-14 12:49,
Bug,,CAMEL-11904,13109211,,Increase dependency java-util-version to min. 1.26.1,ancosen,graben,Minor,Resolved,Fixed,2017-10-13 9:46,2017-10-13 10:28,
Bug,,CAMEL-11901,13108938,,cluster-service : ClusterVie's  getMaster() should be renamed to getLeader() for naming consistency,lb,lb,Minor,Resolved,Fixed,2017-10-12 15:06,2017-10-12 17:05,
Bug,,CAMEL-11883,13107201,,New arguments to createGroup unintentionally made mandatory,davsclaus,fjollberg,Minor,Resolved,Fixed,2017-10-05 11:12,2017-10-05 16:07,
Bug,,CAMEL-11808,13104252,,log4j2 2.9 upgrade causes errors in camel-salesforce and others,davsclaus,davsclaus,Minor,Resolved,Fixed,2017-09-22 10:36,2017-09-27 7:09,
Bug,,CAMEL-11840,13104961,,camel-iBug-karaf - CamelLinkedinBug fails,tadayosi,tadayosi,Minor,Resolved,Fixed,2017-09-26 1:42,2017-09-26 7:00,
Bug,,CAMEL-11839,13104954,,camel-iBug-karaf - CamelBoxBug fails,tadayosi,tadayosi,Minor,Resolved,Fixed,2017-09-26 0:55,2017-09-26 7:00,
Bug,,CAMEL-11802,13103989,,Connector options should be overriden by endpoint URI parameters,zregvart,zregvart,Minor,Resolved,Invalid,2017-09-21 15:44,2017-09-21 16:05,
Bug,,CAMEL-11663,13093753,,Create Karaf features for IEC 60870,lb,ctron,Minor,Resolved,Fixed,2017-08-10 11:13,2017-09-19 15:11,
Sub-Bug,,CAMEL-11762,13100468,13090798,Add Karaf Feature for ASN.1 DataFormat,onders,onders,Minor,Resolved,Fixed,2017-09-07 13:55,2017-09-09 22:14,
Bug,,CAMEL-11734,13099148,,Upgrade grpc-java to 1.6.1,dmvolod,jamesnetherton,Minor,Resolved,Fixed,2017-09-01 6:17,2017-09-08 8:49,
Bug,,CAMEL-11383,13077915,,Replace Jersey JAX-RS client with CXF in Bonita component,jamesnetherton,jamesnetherton,Minor,Resolved,Fixed,2017-06-07 7:57,2017-09-07 11:27,
Bug,,CAMEL-11757,13100219,,Upgrade CometD library,ancosen,vrlgohel,Minor,Resolved,Fixed,2017-09-06 16:59,2017-09-07 9:00,
Bug,,CAMEL-11721,13098195,,Camel Kafka component JSON metadata is invalid ,jamesnetherton,jamesnetherton,Minor,Resolved,Fixed,2017-08-29 8:27,2017-08-29 9:57,
Bug,,CAMEL-11692,13096789,,Set ClassLoader property on HBase configuration,jamesnetherton,jamesnetherton,Minor,Resolved,Fixed,2017-08-22 15:13,2017-08-23 9:25,
Bug,,CAMEL-11654,13093407,,Add missing CXF dependencies to parent POM,jamesnetherton,jamesnetherton,Minor,Resolved,Fixed,2017-08-09 8:47,2017-08-22 19:36,
Bug,,CAMEL-11676,13095612,,Upgrade HBase to 1.2.6,davsclaus,jamesnetherton,Minor,Resolved,Fixed,2017-08-18 11:30,2017-08-21 5:20,
Bug,,CAMEL-11629,13092139,,Cleanup SalesforceComponentVerifierBug,zregvart,zregvart,Minor,Resolved,Done,2017-08-03 9:29,2017-08-14 20:09,
Bug,,CAMEL-11607,13090418,,NPE in MBeanInfoAssembler when debug is enabled,ancosen,sarel,Minor,Resolved,Fixed,2017-07-27 5:02,2017-07-27 13:59,
Bug,,CAMEL-11534,13086274,,Incorrect transferExchange option Bug in camel-jms component,davsclaus,dmvolod,Minor,Resolved,Fixed,2017-07-11 14:24,2017-07-11 15:23,
Bug,,CAMEL-11374,13076403,,Add JMX details to Camel Acturator endpoint,gzurowski,gzurowski,Minor,Resolved,Fixed,2017-06-01 6:32,2017-07-11 8:36,
Bug,,CAMEL-11517,13085147,,transferExchange option doesn't work as expected,dmvolod,dmvolod,Minor,Closed,Not A Problem,2017-07-06 9:32,2017-07-06 10:48,
Bug,,CAMEL-11402,13079443,,Logic error in authentication type determination,zregvart,zregvart,Minor,Resolved,Fixed,2017-06-13 10:32,2017-06-13 10:38,
Bug,,CAMEL-11335,13075089,,Create Actuator endpoint to expose route information,gzurowski,gzurowski,Minor,Resolved,Fixed,2017-05-26 7:00,2017-06-01 6:32,
Bug,,CAMEL-11314,13074430,,Fix failing Bugs in camel-swagger-java,zregvart,zregvart,Minor,Resolved,Fixed,2017-05-24 8:05,2017-05-24 8:54,
Bug,,CAMEL-11602,13090195,,camel-cxf - there are failing Bug cases on Windows,onders,onders,Trivial,Resolved,Fixed,2017-07-26 13:07,2017-09-13 6:49,
Bug,,CAMEL-11526,13085786,,Several files in user manual issue warnings when processing with asciidoctor,zregvart,zregvart,Trivial,Resolved,Fixed,2017-07-09 17:57,2017-07-09 18:06,
Bug,,CAMEL-11222,13068363,,Spring Boot Mojo should use formatter properties from JBoss Forge,zregvart,zregvart,Trivial,Resolved,Fixed,2017-05-02 9:19,2017-05-05 11:19,
